[
  {"lane_id":"extended-scout-research","contract_version":"coding.lane-contract/v1.0.0","owner":"source-proxy-scout","authority_class":"research","input_schema":{"type":"object","properties":{"task_id":{"type":"string"},"query":{"type":"string"}},"required":["task_id","query"],"additionalProperties":false},"output_schema":{"type":"object","properties":{"research_id":{"type":"string"},"sources":{"type":"array"},"freshness":{"type":"string"}},"required":["research_id","sources","freshness"],"additionalProperties":false},"failure_schema":{"type":"object","properties":{"reason_code":{"type":"string"}},"required":["reason_code"],"additionalProperties":false},"acknowledgement_schema":{"type":"object","properties":{"consumer":{"type":"string"},"research_id":{"type":"string"}},"required":["consumer","research_id"],"additionalProperties":false},"evidence_schema":{"type":"object","properties":{"source_hash":{"type":"string"}},"required":["source_hash"],"additionalProperties":false},"compatible_consumer_versions":["coding-orchestrator/v1"],"deprecation_state":"active"},
  {"lane_id":"extended-obsidian-knowledge","contract_version":"coding.lane-contract/v1.0.0","owner":"source-proxy-context","authority_class":"context-read","input_schema":{"type":"object","properties":{"task_id":{"type":"string"},"vault_identity":{"type":"string"}},"required":["task_id","vault_identity"],"additionalProperties":false},"output_schema":{"type":"object","properties":{"context_id":{"type":"string"},"notes":{"type":"array"},"freshness":{"type":"string"}},"required":["context_id","notes","freshness"],"additionalProperties":false},"failure_schema":{"type":"object","properties":{"reason_code":{"type":"string"}},"required":["reason_code"],"additionalProperties":false},"acknowledgement_schema":{"type":"object","properties":{"consumer":{"type":"string"},"context_id":{"type":"string"}},"required":["consumer","context_id"],"additionalProperties":false},"evidence_schema":{"type":"object","properties":{"note_hash":{"type":"string"}},"required":["note_hash"],"additionalProperties":false},"compatible_consumer_versions":["coding-orchestrator/v1"],"deprecation_state":"active"},
  {"lane_id":"extended-mac-worker","contract_version":"coding.lane-contract/v1.0.0","owner":"source-proxy-mac-worker","authority_class":"platform-execution","input_schema":{"type":"object","properties":{"task_id":{"type":"string"},"source_commit":{"type":"string"}},"required":["task_id","source_commit"],"additionalProperties":false},"output_schema":{"type":"object","properties":{"job_id":{"type":"string"},"verdict":{"type":"string"},"artifact_hash":{"type":"string"}},"required":["job_id","verdict","artifact_hash"],"additionalProperties":false},"failure_schema":{"type":"object","properties":{"reason_code":{"type":"string"}},"required":["reason_code"],"additionalProperties":false},"acknowledgement_schema":{"type":"object","properties":{"consumer":{"type":"string"},"job_id":{"type":"string"}},"required":["consumer","job_id"],"additionalProperties":false},"evidence_schema":{"type":"object","properties":{"log_hash":{"type":"string"}},"required":["log_hash"],"additionalProperties":false},"compatible_consumer_versions":["coding-orchestrator/v1"],"deprecation_state":"active"},
  {"lane_id":"extended-context-model","contract_version":"coding.lane-contract/v1.0.0","owner":"source-proxy-model-router","authority_class":"advisory","input_schema":{"type":"object","properties":{"task_id":{"type":"string"},"context_hash":{"type":"string"}},"required":["task_id","context_hash"],"additionalProperties":false},"output_schema":{"type":"object","properties":{"invocation_id":{"type":"string"},"recommendation":{"type":"string"},"model_identity":{"type":"string"}},"required":["invocation_id","recommendation","model_identity"],"additionalProperties":false},"failure_schema":{"type":"object","properties":{"reason_code":{"type":"string"}},"required":["reason_code"],"additionalProperties":false},"acknowledgement_schema":{"type":"object","properties":{"consumer":{"type":"string"},"invocation_id":{"type":"string"}},"required":["consumer","invocation_id"],"additionalProperties":false},"evidence_schema":{"type":"object","properties":{"output_hash":{"type":"string"}},"required":["output_hash"],"additionalProperties":false},"compatible_consumer_versions":["coding-orchestrator/v1"],"deprecation_state":"active"},
  {"lane_id":"extended-retained-sub-agent","contract_version":"coding.lane-contract/v1.0.0","owner":"source-proxy-agent-registry","authority_class":"advisory","input_schema":{"type":"object","properties":{"task_id":{"type":"string"},"agent_id":{"type":"string"}},"required":["task_id","agent_id"],"additionalProperties":false},"output_schema":{"type":"object","properties":{"invocation_id":{"type":"string"},"agent_identity":{"type":"string"},"result":{"type":"string"}},"required":["invocation_id","agent_identity","result"],"additionalProperties":false},"failure_schema":{"type":"object","properties":{"reason_code":{"type":"string"}},"required":["reason_code"],"additionalProperties":false},"acknowledgement_schema":{"type":"object","properties":{"consumer":{"type":"string"},"invocation_id":{"type":"string"}},"required":["consumer","invocation_id"],"additionalProperties":false},"evidence_schema":{"type":"object","properties":{"output_hash":{"type":"string"}},"required":["output_hash"],"additionalProperties":false},"compatible_consumer_versions":["coding-orchestrator/v1"],"deprecation_state":"active"},
  {"lane_id":"extended-platform-verifier","contract_version":"coding.lane-contract/v1.0.0","owner":"source-proxy-verification","authority_class":"verification","input_schema":{"type":"object","properties":{"task_id":{"type":"string"},"platform_result_hash":{"type":"string"}},"required":["task_id","platform_result_hash"],"additionalProperties":false},"output_schema":{"type":"object","properties":{"verdict":{"type":"string"},"checks":{"type":"array"}},"required":["verdict","checks"],"additionalProperties":false},"failure_schema":{"type":"object","properties":{"reason_code":{"type":"string"}},"required":["reason_code"],"additionalProperties":false},"acknowledgement_schema":{"type":"object","properties":{"consumer":{"type":"string"},"verdict":{"type":"string"}},"required":["consumer","verdict"],"additionalProperties":false},"evidence_schema":{"type":"object","properties":{"verification_hash":{"type":"string"}},"required":["verification_hash"],"additionalProperties":false},"compatible_consumer_versions":["coding-orchestrator/v1"],"deprecation_state":"active"},
  {"lane_id":"extended-conflict-resolver","contract_version":"coding.lane-contract/v1.0.0","owner":"source-proxy-orchestrator","authority_class":"conflict-resolution","input_schema":{"type":"object","properties":{"task_id":{"type":"string"},"claims":{"type":"array"}},"required":["task_id","claims"],"additionalProperties":false},"output_schema":{"type":"object","properties":{"conflict_id":{"type":"string"},"resolution":{"type":"string"},"claim_ceiling":{"type":"string"}},"required":["conflict_id","resolution","claim_ceiling"],"additionalProperties":false},"failure_schema":{"type":"object","properties":{"reason_code":{"type":"string"}},"required":["reason_code"],"additionalProperties":false},"acknowledgement_schema":{"type":"object","properties":{"consumer":{"type":"string"},"conflict_id":{"type":"string"}},"required":["consumer","conflict_id"],"additionalProperties":false},"evidence_schema":{"type":"object","properties":{"resolution_hash":{"type":"string"}},"required":["resolution_hash"],"additionalProperties":false},"compatible_consumer_versions":["coding-orchestrator/v1"],"deprecation_state":"active"},
  {"lane_id":"extended-diagnosis-envelope","contract_version":"coding.lane-contract/v1.0.0","owner":"source-proxy-observability","authority_class":"observability","input_schema":{"type":"object","properties":{"task_id":{"type":"string"},"run_id":{"type":"string"}},"required":["task_id","run_id"],"additionalProperties":false},"output_schema":{"type":"object","properties":{"diagnosis_id":{"type":"string"},"redaction_verdict":{"type":"string"},"claim_ceiling":{"type":"string"}},"required":["diagnosis_id","redaction_verdict","claim_ceiling"],"additionalProperties":false},"failure_schema":{"type":"object","properties":{"reason_code":{"type":"string"}},"required":["reason_code"],"additionalProperties":false},"acknowledgement_schema":{"type":"object","properties":{"consumer":{"type":"string"},"diagnosis_id":{"type":"string"}},"required":["consumer","diagnosis_id"],"additionalProperties":false},"evidence_schema":{"type":"object","properties":{"envelope_hash":{"type":"string"}},"required":["envelope_hash"],"additionalProperties":false},"compatible_consumer_versions":["coding-orchestrator/v1"],"deprecation_state":"active"}
]
